 Name Of Product,Description,Image,Price,Rating,Store
 hp samsung e1272 termurah original jadul samsung lipat dual sim - Hitam,hp samsung e1272 termurah original jadul samsung lipat dual sim - Hitam,,Rp153.500,(139),Jakarta Utara Little Master.shop,
iPhone 12 Pro / 12 Pro Max 128GB 256GB 512GB Bekas Mulus Fullset Ori - 12 pro, 128gb,iPhone 12 Pro / 12 Pro Max 128GB 256GB 512GB Bekas Mulus Fullset Ori - 12 pro, 128gb,,Rp12.750.000,(237),Jakarta Utara Big Berry Cellular,
Apple iPhone XR 128gb BH 100% MULUS 99% Fullset 3Utools ijo like new - Biru, 64 gb,Apple iPhone XR 128gb BH 100% MULUS 99% Fullset 3Utools ijo like new - Biru, 64 gb,,Rp4.820.000,(160),Jakarta Barat Life Technology,
veeicee teiseeuoll 2.5geeebi,veeicee teiseeuoll 2.5geeebi,,Rp8.375,(116),Kab. Karawang Sonia Group Cellular,
Xiaomi POCO X3 GT 8+256GB NFC 6.6” Layar Smartphone Android HP - Wave Blue,Xiaomi POCO X3 GT 8+256GB NFC 6.6” Layar Smartphone Android HP - Wave Blue,,Rp4.699.000,(497),Kab. Tangerang Xiaomi Official Store,
IPhone 12 Pro Garansi Resmi Ibox,IPhone 12 Pro Garansi Resmi Ibox,,Rp17.929.000,(381),Jakarta Barat PT Pratama Sntra Semesta,
Xiaomi Official Redmi 9A 2/32GB 6.53" HD Mi Smartphone AI Face Unlock,Xiaomi Official Redmi 9A 2/32GB 6.53" HD Mi Smartphone AI Face Unlock,,Rp1.299.000,(4426),Kab. Tangerang Xiaomi Official Store,
Xiaomi Redmi 9A 2/32 ~ 3/32 GB Garansi Resmi , IMEI Terdaftar,Xiaomi Redmi 9A 2/32 ~ 3/32 GB Garansi Resmi , IMEI Terdaftar,,Rp1.299.000,(1718),Jakarta Barat duniagadgetku,
Samsung M32 6/128GB GARANSI RESMI SAMSUNG INDONESIA,Samsung M32 6/128GB GARANSI RESMI SAMSUNG INDONESIA,,Rp2.799.000,(156),Jakarta Barat centralphone73,
XIAOMI Mi POCO X3 Pro 6/128GB NFC Snapdragon™ 860 48MP 5160mAh,XIAOMI Mi POCO X3 Pro 6/128GB NFC Snapdragon™ 860 48MP 5160mAh,,Rp3.499.000,(2761),Kab. Tangerang Xiaomi Official Store,
