 Name Of Product,Description,Image,Price,Rating,Store
 iPhone 11 Second Fullset - Merah, 128 gb,iPhone 11 Second Fullset - Merah, 128 gb,,Rp7.600.000,(35),Jakarta Barat SHZ Mobile,
iPhone 8 SECOND - Gold, 64 gb,iPhone 8 SECOND - Gold, 64 gb,,Rp2.800.000,(300),Jakarta Barat KEY PHONE CELLULAR,
IPHONE XR 64 GB FULLSET SECOND ORIGINAL 100% - LIKE NEW - 128gb fullset,IPHONE XR 64 GB FULLSET SECOND ORIGINAL 100% - LIKE NEW - 128gb fullset,,Rp5.200.000,(85),Jakarta Utara AA Store168,
Hp SAMSUNG LIPAT E1272 TERMURAH dual sim 2 Garansi Distributor - Hitam,Hp SAMSUNG LIPAT E1272 TERMURAH dual sim 2 Garansi Distributor - Hitam,,Rp155.000,(363),Tangerang sodo shop,
iPhone 13 Pro Max 128GB 256GB 512GB 1TB Sierra Blue Graphite Gold Silv - INTER 128GB, Gold,iPhone 13 Pro Max 128GB 256GB 512GB 1TB Sierra Blue Graphite Gold Silv - INTER 128GB, Gold,,Rp19.490.000,(463),Jakarta Pusat Putra Group,
XIAOMI POCO F3 6/128GB NFC Snapdragon™ 870 48MP 4520mAh HP Android,XIAOMI POCO F3 6/128GB NFC Snapdragon™ 870 48MP 4520mAh HP Android,,Rp4.999.000,(587),Kab. Tangerang Xiaomi Official Store,
Nokia Feature Phone N-150 New 2020 Dual Sim Garansi Resmi,Nokia Feature Phone N-150 New 2020 Dual Sim Garansi Resmi,,Rp425.000,(400),Jakarta Pusat Indokom Store,
Xiaomi Redmi 9A 2/32 ~ 3/32 GB Garansi Resmi , IMEI Terdaftar,Xiaomi Redmi 9A 2/32 ~ 3/32 GB Garansi Resmi , IMEI Terdaftar,,Rp1.299.000,(1719),Jakarta Barat duniagadgetku,
Samsung M32 6/128GB GARANSI RESMI SAMSUNG INDONESIA,Samsung M32 6/128GB GARANSI RESMI SAMSUNG INDONESIA,,Rp2.799.000,(156),Jakarta Barat centralphone73,
Samsung Galaxy A72 8/128 8/256 Kamera 4K GB RAM 8 ROM 128 256 Resmi,Samsung Galaxy A72 8/128 8/256 Kamera 4K GB RAM 8 ROM 128 256 Resmi,,Rp5.290.000,(581),Jakarta Pusat SUPER_GADGET,
